signal_code,spend_implication
NATAL_STRUCTURE_2H_SIGN,Personal earning/spending style baseline derived from 2nd house sign.
NATAL_STRUCTURE_2H_RULER,Primary money behavior indicator from 2nd house ruler placement and strength.
NATAL_STRUCTURE_8H_SIGN,Debt/loans/shared finance attitude derived from 8th house sign.
NATAL_STRUCTURE_8H_RULER,Risk exposure and shared-resource behavior from 8th house ruler placement.
NATAL_STRUCTURE_VENUS_CONDITION,"Taste, attraction, and spending preferences based on Venus sign, house, dignity, and strength."
NATAL_STRUCTURE_SATURN_PROMINENCE,"Discipline, restraint, and long-term financial control based on Saturn strength and angularity."
NATAL_STRUCTURE_JUPITER_PROMINENCE,"Growth, optimism, indulgence tendency based on Jupiter strength and angularity."
